{
  "id": "more-134",
  "perspective": "user",
  "title": "今天谁拿过东西",
  "tags": [
    "more",
    "daily"
  ],
  "setup": {
    "fixture": "home-wide"
  },
  "prompt": "今天谁拿过东西",
  "expected": {
    "outcome": "看今天的记录",
    "requiredToolsAny": [
      "activity.list"
    ],
    "forbiddenTools": [
      "item.create",
      "item.createMany",
      "item.update",
      "item.remove",
      "item.removeMany",
      "item.merge"
    ]
  }
}
