{
  "id": "scene-record-mask",
  "perspective": "product",
  "title": "客厅记一盒口罩",
  "tags": [
    "scene",
    "wide"
  ],
  "setup": {
    "fixture": "home-wide"
  },
  "prompt": "客厅记一盒口罩",
  "expected": {
    "outcome": "在客厅新建口罩 1 盒",
    "requiredToolsAny": [
      "item.create",
      "item.createMany"
    ],
    "forbiddenTools": [
      "item.remove",
      "item.update"
    ],
    "callIncludes": [
      {
        "name": "口罩",
        "quantity": 1,
        "spaceName": "客厅"
      }
    ]
  }
}
