{
  "id": "more-097",
  "perspective": "user",
  "title": "薯片看电影吃了一袋",
  "tags": [
    "more",
    "daily"
  ],
  "setup": {
    "fixture": "home-wide"
  },
  "prompt": "薯片看电影吃了一袋",
  "expected": {
    "outcome": "按说的改现有那一件，不删、不另记",
    "requiredTools": [
      "item.update"
    ],
    "forbiddenTools": [
      "item.remove",
      "item.removeMany",
      "item.create",
      "item.createMany"
    ],
    "callIncludes": [
      {
        "use": "item.update",
        "name": "薯片",
        "quantity": 1
      }
    ]
  }
}
