{
  "id": "more-139",
  "perspective": "user",
  "title": "苹果",
  "tags": [
    "more",
    "daily"
  ],
  "setup": {
    "fixture": "home-wide"
  },
  "prompt": "苹果",
  "expected": {
    "outcome": "没说清就先问，先不改账",
    "mustAsk": true,
    "forbiddenTools": [
      "item.update",
      "item.remove",
      "item.removeMany",
      "item.create",
      "item.createMany"
    ]
  }
}
